gpu_pointpillar/model/pointpillar.8611.log
[02/25/2024-05:14:33] [V] [TRT] *************** Autotuning format combination: Float(320,10,1) -> Float(10,1,1,1) ***************
[02/25/2024-05:14:33] [V] [TRT] --------------- Timing Runner: reshape_0 + reshape_before_MatMul_161 (Shuffle[0x8000000d])
[02/25/2024-05:14:33] [V] [TRT] Tactic: 0x0000000000000000 Time: 0.107154
[02/25/2024-05:14:33] [V] [TRT] Tactic: 0x0000000000000001 Time: 0.214715
[02/25/2024-05:14:33] [V] [TRT] reshape_0 + reshape_before_MatMul_161 (Shuffle[0x8000000d]) profiling completed in 0.00510026 seconds. Fastest Tactic: 0x0000000000000000 Time: 0.107154
[02/25/2024-05:14:33] [V] [TRT] >>>>>>>>>>>>>>> Chose Runner Type: Shuffle Tactic: 0x0000000000000000
[02/25/2024-05:14:33] [V] [TRT] *************** Autotuning format combination: Float(320,10,1) -> Float(3,1:4,3,3) ***************
[02/25/2024-05:14:33] [V] [TRT] --------------- Timing Runner: reshape_0 + reshape_before_MatMul_161 (Shuffle[0x8000000d])
[02/25/2024-05:14:33] [V] [TRT] Tactic: 0x0000000000000000 Time: 0.17013
[02/25/2024-05:14:33] [V] [TRT] reshape_0 + reshape_before_MatMul_161 (Shuffle[0x8000000d]) profiling completed in 0.00198656 seconds. Fastest Tactic: 0x0000000000000000 Time: 0.17013
[02/25/2024-05:14:33] [V] [TRT] >>>>>>>>>>>>>>> Chose Runner Type: Shuffle Tactic: 0x0000000000000000
[02/25/2024-05:14:33] [V] [TRT] *************** Autotuning format combination: Float(1,100000,10000) -> Float(10,1,10,10) ***************
[02/25/2024-05:14:33] [V] [TRT] --------------- Timing Runner: reshape_0 + reshape_before_MatMul_161 (Shuffle[0x8000000d])
[02/25/2024-05:14:33] [V] [TRT] Tactic: 0x0000000000000000 Time: 0.143067
[02/25/2024-05:14:33] [V] [TRT] Tactic: 0x0000000000000001 Time: 0.435346
[02/25/2024-05:14:33] [V] [TRT] reshape_0 + reshape_before_MatMul_161 (Shuffle[0x8000000d]) profiling completed in 0.00652937 seconds. Fastest Tactic: 0x0000000000000000 Time: 0.143067
[02/25/2024-05:14:33] [V] [TRT] >>>>>>>>>>>>>>> Chose Runner Type: Shuffle Tactic: 0x0000000000000000
[02/25/2024-05:14:33] [V] [TRT] *************** Autotuning format combination: Float(1:4,25000,2500) -> Float(10,1,1,1) ***************
[02/25/2024-05:14:33] [V] [TRT] --------------- Timing Runner: reshape_0 + reshape_before_MatMul_161 (Shuffle[0x8000000d])
[02/25/2024-05:14:33] [V] [TRT] Tactic: 0x0000000000000000 Time: 0.143067
[02/25/2024-05:14:33] [V] [TRT] reshape_0 + reshape_before_MatMul_161 (Shuffle[0x8000000d]) profiling completed in 0.00164609 seconds. Fastest Tactic: 0x0000000000000000 Time: 0.143067
[02/25/2024-05:14:33] [V] [TRT] >>>>>>>>>>>>>>> Chose Runner Type: Shuffle Tactic: 0x0000000000000000
[02/25/2024-05:14:33] [V] [TRT] *************** Autotuning format combination: Float(1:4,25000,2500) -> Float(3,1:4,3,3) ***************
[02/25/2024-05:14:33] [V] [TRT] --------------- Timing Runner: reshape_0 + reshape_before_MatMul_161 (Shuffle[0x8000000d])
[02/25/2024-05:14:33] [V] [TRT] Tactic: 0x0000000000000000 Time: 0.210651
[02/25/2024-05:14:33] [V] [TRT] Tactic: 0x0000000000000001 Time: 0.436955
[02/25/2024-05:14:33] [V] [TRT] reshape_0 + reshape_before_MatMul_161 (Shuffle[0x8000000d]) profiling completed in 0.00738879 seconds. Fastest Tactic: 0x0000000000000000 Time: 0.210651
[02/25/2024-05:14:33] [V] [TRT] >>>>>>>>>>>>>>> Chose Runner Type: Shuffle Tactic: 0x0000000000000000
[02/25/2024-05:14:33] [V] [TRT] *************** Autotuning format combination: Float(320:32,10,1) -> Float(1,1:32,1,1) ***************
[02/25/2024-05:14:33] [V] [TRT] --------------- Timing Runner: reshape_0 + reshape_before_MatMul_161 (Shuffle[0x8000000d])
[02/25/2024-05:14:33] [V] [TRT] Tactic: 0x0000000000000000 Time: 0.270482
[02/25/2024-05:14:33] [V] [TRT] Tactic: 0x0000000000000001 Time: 0.441929
[02/25/2024-05:14:33] [V] [TRT] reshape_0 + reshape_before_MatMul_161 (Shuffle[0x8000000d]) profiling completed in 0.0081319 seconds. Fastest Tactic: 0x0000000000000000 Time: 0.270482
[02/25/2024-05:14:33] [V] [TRT] >>>>>>>>>>>>>>> Chose Runner Type: Shuffle Tactic: 0x0000000000000000
[02/25/2024-05:14:33] [V] [TRT] *************** Autotuning format combination: Half(320,10,1) -> Half(10,1,1,1) ***************
[02/25/2024-05:14:33] [V] [TRT] --------------- Timing Runner: reshape_0 + reshape_before_MatMul_161 (Shuffle[0x8000000d])
[02/25/2024-05:14:33] [V] [TRT] Tactic: 0x0000000000000000 Time: 0.0581242
[02/25/2024-05:14:33] [V] [TRT] Tactic: 0x0000000000000001 Time: 0.113883
[02/25/2024-05:14:33] [V] [TRT] reshape_0 + reshape_before_MatMul_161 (Shuffle[0x8000000d]) profiling completed in 0.00445476 seconds. Fastest Tactic: 0x0000000000000000 Time: 0.0581242
[02/25/2024-05:14:33] [V] [TRT] >>>>>>>>>>>>>>> Chose Runner Type: Shuffle Tactic: 0x0000000000000000
[02/25/2024-05:14:33] [V] [TRT] *************** Autotuning format combination: Half(320,10,1) -> Half(5,1:2,5,5) ***************
[02/25/2024-05:14:33] [V] [TRT] --------------- Timing Runner: reshape_0 + reshape_before_MatMul_161 (Shuffle[0x8000000d])
[02/25/2024-05:14:33] [V] [TRT] Tactic: 0x0000000000000000 Time: 0.0773006
[02/25/2024-05:14:33] [V] [TRT] reshape_0 + reshape_before_MatMul_161 (Shuffle[0x8000000d]) profiling completed in 0.00149889 seconds. Fastest Tactic: 0x0000000000000000 Time: 0.0773006
[02/25/2024-05:14:33] [V] [TRT] >>>>>>>>>>>>>>> Chose Runner Type: Shuffle Tactic: 0x0000000000000000
[02/25/2024-05:14:33] [V] [TRT] *************** Autotuning format combination: Half(320,10,1) -> Half(2,1:8,2,2) ***************
[02/25/2024-05:14:33] [V] [TRT] --------------- Timing Runner: reshape_0 + reshape_before_MatMul_161 (Shuffle[0x8000000d])
[02/25/2024-05:14:33] [V] [TRT] Tactic: 0x0000000000000000 Time: 0.128731
[02/25/2024-05:14:33] [V] [TRT] reshape_0 + reshape_before_MatMul_161 (Shuffle[0x8000000d]) profiling completed in 0.0024955 seconds. Fastest Tactic: 0x0000000000000000 Time: 0.128731
[02/25/2024-05:14:33] [V] [TRT] >>>>>>>>>>>>>>> Chose Runner Type: Shuffle Tactic: 0x0000000000000000
[02/25/2024-05:14:33] [V] [TRT] *************** Autotuning format combination: Half(320:2,10,1) -> Half(5,1:2,1,1) ***************
[02/25/2024-05:14:33] [V] [TRT] --------------- Timing Runner: reshape_0 + reshape_before_MatMul_161 (Shuffle[0x8000000d])
[02/25/2024-05:14:33] [V] [TRT] Tactic: 0x0000000000000000 Time: 0.083456
[02/25/2024-05:14:33] [V] [TRT] Tactic: 0x0000000000000001 Time: 0.215918
[02/25/2024-05:14:33] [V] [TRT] reshape_0 + reshape_before_MatMul_161 (Shuffle[0x8000000d]) profiling completed in 0.00420437 seconds. Fastest Tactic: 0x0000000000000000 Time: 0.083456
[02/25/2024-05:14:33] [V] [TRT] >>>>>>>>>>>>>>> Chose Runner Type: Shuffle Tactic: 0x0000000000000000
[02/25/2024-05:14:33] [V] [TRT] *************** Autotuning format combination: Half(1:2,50000,5000) -> Half(10,1,1,1) ***************
[02/25/2024-05:14:33] [V] [TRT] --------------- Timing Runner: reshape_0 + reshape_before_MatMul_161 (Shuffle[0x8000000d])
[02/25/2024-05:14:33] [V] [TRT] Tactic: 0x0000000000000000 Time: 0.119223
[02/25/2024-05:14:33] [V] [TRT] reshape_0 + reshape_before_MatMul_161 (Shuffle[0x8000000d]) profiling completed in 0.00224943 seconds. Fastest Tactic: 0x0000000000000000 Time: 0.119223
[02/25/2024-05:14:33] [V] [TRT] >>>>>>>>>>>>>>> Chose Runner Type: Shuffle Tactic: 0x0000000000000000
[02/25/2024-05:14:33] [V] [TRT] *************** Autotuning format combination: Half(1:2,50000,5000) -> Half(5,1:2,5,5) ***************
[02/25/2024-05:14:33] [V] [TRT] --------------- Timing Runner: reshape_0 + reshape_before_MatMul_161 (Shuffle[0x8000000d])
[02/25/2024-05:14:33] [V] [TRT] Tactic: 0x0000000000000000 Time: 0.122951
[02/25/2024-05:14:33] [V] [TRT] Tactic: 0x0000000000000001 Time: 0.187392
[02/25/2024-05:14:33] [V] [TRT] reshape_0 + reshape_before_MatMul_161 (Shuffle[0x8000000d]) profiling completed in 0.00467944 seconds. Fastest Tactic: 0x0000000000000000 Time: 0.122951
[02/25/2024-05:14:33] [V] [TRT] >>>>>>>>>>>>>>> Chose Runner Type: Shuffle Tactic: 0x0000000000000000
[02/25/2024-05:14:33] [V] [TRT] *************** Autotuning format combination: Half(1:4,25000,2500) -> Half(3,1:4,3,3) ***************
[02/25/2024-05:14:33] [V] [TRT] --------------- Timing Runner: reshape_0 + reshape_before_MatMul_161 (Shuffle[0x8000000d])
[02/25/2024-05:14:33] [V] [TRT] Tactic: 0x0000000000000000 Time: 0.163109
[02/25/2024-05:14:33] [V] [TRT] Tactic: 0x0000000000000001 Time: 0.188562
[02/25/2024-05:14:33] [V] [TRT] reshape_0 + reshape_before_MatMul_161 (Shuffle[0x8000000d]) profiling completed in 0.00375663 seconds. Fastest Tactic: 0x0000000000000000 Time: 0.163109
[02/25/2024-05:14:33] [V] [TRT] >>>>>>>>>>>>>>> Chose Runner Type: Shuffle Tactic: 0x0000000000000000
[02/25/2024-05:14:33] [V] [TRT] *************** Autotuning format combination: Half(1:8,12500,1250) -> Half(10,1,1,1) ***************
[02/25/2024-05:14:33] [V] [TRT] --------------- Timing Runner: reshape_0 + reshape_before_MatMul_161 (Shuffle[0x8000000d])
[02/25/2024-05:14:33] [V] [TRT] Tactic: 0x0000000000000000 Time: 0.118418
[02/25/2024-05:14:33] [V] [TRT] reshape_0 + reshape_before_MatMul_161 (Shuffle[0x8000000d]) profiling completed in 0.00224734 seconds. Fastest Tactic: 0x0000000000000000 Time: 0.118418
[02/25/2024-05:14:33] [V] [TRT] >>>>>>>>>>>>>>> Chose Runner Type: Shuffle Tactic: 0x0000000000000000
[02/25/2024-05:14:33] [V] [TRT] *************** Autotuning format combination: Half(1:8,12500,1250) -> Half(2,1:8,2,2) ***************
[02/25/2024-05:14:33] [V] [TRT] --------------- Timing Runner: reshape_0 + reshape_before_MatMul_161 (Shuffle[0x8000000d])
[02/25/2024-05:14:33] [V] [TRT] Tactic: 0x0000000000000000 Time: 0.179785
[02/25/2024-05:14:33] [V] [TRT] Tactic: 0x0000000000000001 Time: 0.189879
[02/25/2024-05:14:33] [V] [TRT] reshape_0 + reshape_before_MatMul_161 (Shuffle[0x8000000d]) profiling completed in 0.00393597 seconds. Fastest Tactic: 0x0000000000000000 Time: 0.179785
[02/25/2024-05:14:33] [V] [TRT] >>>>>>>>>>>>>>> Chose Runner Type: Shuffle Tactic: 0x0000000000000000
[02/25/2024-05:14:33] [V] [TRT] *************** Autotuning format combination: Half(1:16,6250,625) -> Half(1,1:16,1,1) ***************
[02/25/2024-05:14:33] [V] [TRT] --------------- Timing Runner: reshape_0 + reshape_before_MatMul_161 (Shuffle[0x8000000d])
[02/25/2024-05:14:33] [V] [TRT] Tactic: 0x0000000000000000 Time: 0.178322
[02/25/2024-05:14:33] [V] [TRT] Tactic: 0x0000000000000001 Time: 0.190025
[02/25/2024-05:14:33] [V] [TRT] reshape_0 + reshape_before_MatMul_161 (Shuffle[0x8000000d]) profiling completed in 0.00411038 seconds. Fastest Tactic: 0x0000000000000000 Time: 0.178322
[02/25/2024-05:14:33] [V] [TRT] >>>>>>>>>>>>>>> Chose Runner Type: Shuffle Tactic: 0x0000000000000000
[02/25/2024-05:14:33] [V] [TRT] =============== Computing costs for MatMul_161 + BatchNormalization_163 + Relu_165
[02/25/2024-05:14:33] [V] [TRT] *************** Autotuning format combination: Float(10,1,1,1) -> Float(64,1,1,1) ***************
[02/25/2024-05:14:33] [V] [TRT] --------------- Timing Runner: MatMul_161 + BatchNormalization_163 + Relu_165 (CaskConvolution[0x80000009])
[02/25/2024-05:14:34] [V] [TRT] Tactic Name: ampere_scudnn_128x128_relu_medium_nn_v1 Tactic: 0xf067e6205da31c2e Time: 1.85827
[02/25/2024-05:14:34] [V] [TRT] Tactic Name: ampere_scudnn_128x64_relu_small_nn_v1 Tactic: 0x3f243c490d502deb Time: 1.90069
[02/25/2024-05:14:34] [V] [TRT] Tactic Name: ampere_scudnn_128x128_relu_interior_nn_v1 Tactic: 0xa8ef60e712f8ad24 Time: 1.85198
[02/25/2024-05:14:34] [V] [TRT] Tactic Name: ampere_scudnn_128x128_relu_small_nn_v1 Tactic: 0x503619c69ae500ff Time: 1.80751
[02/25/2024-05:14:34] [V] [TRT] Tactic Name: sm80_xmma_fprop_implicit_gemm_indexed_f32f32_f32f32_f32_nchwkcrs_nchw_tilesize128x64x8_stage2_warpsize1x4x1_g1_ffma_aligna4_alignc4_beta0_packed_stride Tactic: 0xede36641840ce3d2 Time: 1.86222
[02/25/2024-05:14:34] [V] [TRT] Tactic Name: sm80_xmma_fprop_implicit_gemm_indexed_f32f32_f32f32_f32_nchwkcrs_nchw_tilesize128x32x8_stage3_warpsize2x2x1_g1_ffma_aligna4_alignc4 Tactic: 0xa9366041633a5135 Time: 1.8928
[02/25/2024-05:14:34] [V] [TRT] Tactic Name: sm80_xmma_fprop_implicit_gemm_indexed_f32f32_f32f32_f32_nchwkcrs_nchw_tilesize128x64x8_stage2_warpsize4x1x1_g1_ffma_aligna4_alignc4_beta0_packed_stride Tactic: 0x1673e3594ce11cea Time: 1.84686
[02/25/2024-05:14:34] [V] [TRT] Tactic Name: sm80_xmma_fprop_implicit_gemm_f32f32_f32f32_f32_nchwkcrs_nchw_tilesize64x256x8_stage3_warpsize1x4x1_g1_ffma_t1r1s1_aligna4_alignc4 Tactic: 0x2ee10e11d6651675 Time: 2.27313
[02/25/2024-05:14:34] [V] [TRT] Tactic Name: sm80_xmma_fprop_implicit_gemm_indexed_f32f32_f32f32_f32_nchwkcrs_nchw_tilesize32x32x8_stage3_warpsize1x2x1_g1_ffma_aligna4_alignc4 Tactic: 0xcb8a43f748d8a338 Time: 1.74754
[02/25/2024-05:14:34] [V] [TRT] Tactic Name: sm80_xmma_fprop_implicit_gemm_f32f32_f32f32_f32_nchwkcrs_nchw_tilesize64x128x8_stage3_warpsize1x4x1_g1_ffma_aligna4_alignc4 Tactic: 0x5aa723e0481da855 Time: 1.73787
[02/25/2024-05:14:34] [V] [TRT] Tactic Name: sm80_xmma_fprop_implicit_gemm_f32f32_f32f32_f32_nchwkcrs_nchw_tilesize64x64x8_stage3_warpsize1x4x1_g1_ffma_t1r1s1_aligna4_alignc4 Tactic: 0x865894c4635db7fd Time: 1.60712
[02/25/2024-05:14:34] [V] [TRT] Tactic Name: sm80_xmma_fprop_implicit_gemm_indexed_f32f32_f32f32_f32_nchwkcrs_nchw_tilesize128x16x8_stage3_warpsize4x1x1_g1_ffma_aligna4_alignc4 Tactic: 0x40a12e3938221818 Time: 1.81979
[02/25/2024-05:14:34] [V] [TRT] Tactic Name: sm80_xmma_fprop_implicit_gemm_f32f32_f32f32_f32_nchwkcrs_nchw_tilesize256x128x8_stage3_warpsize4x2x1_g1_ffma_simple_t1r1s1_aligna4_alignc4 Tactic: 0xfff46c7893896eb1 Time: 1.80543
[02/25/2024-05:14:34] [V] [TRT] Tactic Name: sm80_xmma_fprop_implicit_gemm_f32f32_f32f32_f32_nchwkcrs_nchw_tilesize32x32x8_stage3_warpsize1x2x1_g1_ffma_aligna4_alignc4 Tactic: 0xb0bf940d5e0f9f45 Time: 1.71374
[02/25/2024-05:14:34] [V] [TRT] Tactic Name: sm80_xmma_fprop_implicit_gemm_indexed_f32f32_f32f32_f32_nchwkcrs_nchw_tilesize64x64x8_stage3_warpsize1x4x1_g1_ffma_aligna4_alignc4 Tactic: 0xd828f024626fa982 Time: 1.63518
[02/25/2024-05:14:34] [V] [TRT] Tactic Name: sm80_xmma_fprop_implicit_gemm_indexed_f32f32_f32f32_f32_nchwkcrs_nchw_tilesize128x64x8_stage2_warpsize2x2x1_g1_ffma_aligna4_alignc4_beta0_packed_stride Tactic: 0x31aa67f57c5aea77 Time: 1.56628
[02/25/2024-05:14:34] [V] [TRT] Tactic Name: sm80_xmma_fprop_implicit_gemm_f32f32_f32f32_f32_nchwkcrs_nchw_tilesize64x128x8_stage3_warpsize1x4x1_g1_ffma_simple_t1r1s1_aligna4_alignc4 Tactic: 0x9cd5cdc35441c505 Time: 1.72603
[02/25/2024-05:14:34] [V] [TRT] Tactic Name: sm80_xmma_fprop_implicit_gemm_f32f32_f32f32_f32_nchwkcrs_nchw_tilesize128x32x8_stage3_warpsize2x2x1_g1_ffma_simple_t1r1s1_aligna4_alignc4 Tactic: 0x828d0ea88c66fce7 Time: 1.74373
[02/25/2024-05:14:34] [V] [TRT] Tactic Name: sm80_xmma_fprop_implicit_gemm_f32f32_f32f32_f32_nchwkcrs_nchw_tilesize64x64x8_stage3_warpsize1x4x1_g1_ffma_simple_t1r1s1_aligna4_alignc4 Tactic: 0x1fc87d7eb370bb7a Time: 1.64103
[02/25/2024-05:14:34] [V] [TRT] Tactic Name: sm80_xmma_fprop_implicit_gemm_f32f32_f32f32_f32_nchwkcrs_nchw_tilesize64x128x8_stage3_warpsize1x4x1_g1_ffma_t1r1s1_aligna4_alignc4 Tactic: 0xc0b05b61d128e46e Time: 1.72076
[02/25/2024-05:14:34] [V] [TRT] Tactic Name: sm80_xmma_fprop_implicit_gemm_f32f32_f32f32_f32_nchwkcrs_nchw_tilesize128x64x8_stage3_warpsize2x2x1_g1_ffma_t1r1s1_aligna4_alignc4 Tactic: 0xe5603263b7f00303 Time: 1.63562
[02/25/2024-05:14:34] [V] [TRT] Tactic Name: sm80_xmma_fprop_implicit_gemm_f32f32_f32f32_f32_nchwkcrs_nchw_tilesize128x16x8_stage3_warpsize4x1x1_g1_ffma_aligna4_alignc4 Tactic: 0x9d9fdb5fd9945f64 Time: 1.81643
[02/25/2024-05:14:34] [V] [TRT] Tactic Name: sm80_xmma_fprop_implicit_gemm_f32f32_f32f32_f32_nchwkcrs_nchw_tilesize64x256x8_stage3_warpsize1x4x1_g1_ffma_simple_t1r1s1_aligna4_alignc4 Tactic: 0x9de226a0c44627c4 Time: 2.16752
[02/25/2024-05:14:34] [V] [TRT] Tactic Name: sm80_xmma_fprop_implicit_gemm_f32f32_f32f32_f32_nchwkcrs_nchw_tilesize128x64x8_stage3_warpsize2x2x1_g1_ffma_simple_t1r1s1_aligna4_alignc4 Tactic: 0x8e3884f0eaec3ecd Time: 1.6286
[02/25/2024-05:14:34] [V] [TRT] Tactic Name: ampere_scudnn_128x32_relu_small_nn_v1 Tactic: 0xa8609adc4e0ceb90 Time: 1.67365
[02/25/2024-05:14:34] [V] [TRT] Tactic Name: sm80_xmma_fprop_implicit_gemm_f32f32_f32f32_f32_nchwkcrs_nchw_tilesize32x32x8_stage3_warpsize1x2x1_g1_ffma_simple_t1r1s1_aligna4_alignc4 Tactic: 0x90f8f2915f87ed77 Time: 1.71973
[02/25/2024-05:14:34] [V] [TRT] Tactic Name: ampere_scudnn_128x64_relu_medium_nn_v1 Tactic: 0xf64396b97c889179 Time: 1.69794
[02/25/2024-05:14:34] [V] [TRT] Tactic Name: sm80_xmma_fprop_implicit_gemm_f32f32_f32f32_f32_nchwkcrs_nchw_tilesize128x64x8_stage3_warpsize2x2x1_g1_ffma_aligna4_alignc4 Tactic: 0x12dbf7d94ee3696d Time: 1.63152
[02/25/2024-05:14:34] [V] [TRT] Tactic Name: ampere_scudnn_128x64_relu_interior_nn_v1 Tactic: 0xc3cf6e1d1c6aff27 Time: 1.64381
[02/25/2024-05:14:34] [V] [TRT] Tactic Name: sm80_xmma_fprop_implicit_gemm_f32f32_f32f32_f32_nchwkcrs_nchw_tilesize64x64x8_stage3_warpsize1x4x1_g1_ffma_aligna4_alignc4 Tactic: 0xa31d27de74b895ff Time: 1.65259
[02/25/2024-05:14:34] [V] [TRT] Tactic Name: ampere_scudnn_128x32_relu_interior_nn_v1 Tactic: 0x9808072e706def96 Time: 1.69544
[02/25/2024-05:14:34] [V] [TRT] Tactic Name: sm80_xmma_fprop_implicit_gemm_f32f32_f32f32_f32_nchwkcrs_nchw_tilesize256x128x8_stage3_warpsize4x2x1_g1_ffma_aligna4_alignc4 Tactic: 0xbb8c3889c7eacd30 Time: 1.83179
[02/25/2024-05:14:34] [V] [TRT] MatMul_161 + BatchNormalization_163 + Relu_165 (CaskConvolution[0x80000009]) profiling completed in 0.634753 seconds. Fastest Tactic: 0x31aa67f57c5aea77 Time: 1.56628
[02/25/2024-05:14:34] [V] [TRT] --------------- Timing Runner: MatMul_161 + BatchNormalization_163 + Relu_165 (CublasConvolution[0x80000029])
[02/25/2024-05:14:34] [V] [TRT] CublasConvolution has no valid tactics for this config, skipping
[02/25/2024-05:14:34] [V] [TRT] MatMul_161 + BatchNormalization_163 + Relu_165: 48 available tactics, 0 unparsable, 24 pruned, 24 remaining after tactic pruning.
[02/25/2024-05:14:34] [V] [TRT] --------------- Timing Runner: MatMul_161 + BatchNormalization_163 + Relu_165 (CaskGemmConvolution[0x8000002e])
[02/25/2024-05:14:34] [V] [TRT] Tactic Name: sm80_xmma_gemm_f32f32_f32f32_f32_nn_n_tilesize128x64x8_stage3_warpsize2x2x1_ffma_aligna4_alignc4 numSplitK: 1 numBuffers: 0 numKernels: 1 Tactic: 0x00000000000202d7 Time: 0.392631
[02/25/2024-05:14:34] [V] [TRT] Tactic Name: sm80_xmma_gemm_f32f32_f32f32_f32_tn_n_tilesize32x64x8_stage3_warpsize1x2x1_ffma_aligna4_alignc4 numSplitK: 1 numBuffers: 0 numKernels: 1 Tactic: 0x0000000000020903 Time: 0.390729
[02/25/2024-05:14:34] [V] [TRT] Tactic Name: sm80_xmma_gemm_f32f32_f32f32_f32_nn_n_tilesize32x64x8_stage3_warpsize1x2x1_ffma_aligna4_alignc4 numSplitK: 1 numBuffers: 0 numKernels: 1 Tactic: 0x0000000000020187 Time: 0.390583
[02/25/2024-05:14:34] [V] [TRT] Tactic Name: sm80_xmma_gemm_f32f32_f32f32_f32_nn_n_tilesize64x32x8_stage3_warpsize1x2x1_ffma_aligna4_alignc4 numSplitK: 1 numBuffers: 0 numKernels: 1 Tactic: 0x00000000000200f7 Time: 0.390144
[02/25/2024-05:14:34] [V] [TRT] Tactic Name: sm80_xmma_gemm_f32f32_f32f32_f32_tn_n_tilesize64x32x8_stage3_warpsize1x2x1_ffma_aligna4_alignc4 numSplitK: 1 numBuffers: 0 numKernels: 1 Tactic: 0x00000000000202dd Time: 0.399506
[02/25/2024-05:14:34] [V] [TRT] Tactic Name: sm80_xmma_gemm_f32f32_f32f32_f32_tn_n_tilesize128x64x8_stage3_warpsize2x2x1_ffma_aligna4_alignc4 numSplitK: 1 numBuffers: 0 numKernels: 1 Tactic: 0x000000000002066b Time: 0.39029
[02/25/2024-05:14:34] [V] [TRT] Tactic Name: sm80_xmma_gemm_f32f32_f32f32_f32_tn_n_tilesize32x32x8_stage3_warpsize1x2x1_ffma_aligna4_alignc4 numSplitK: 1 numBuffers: 0 numKernels: 1 Tactic: 0x0000000000020231 Time: 0.389998
[02/25/2024-05:14:34] [V] [TRT] Tactic Name: sm80_xmma_gemm_f32f32_f32f32_f32_nn_n_tilesize64x64x8_stage3_warpsize1x4x1_ffma_aligna4_alignc4 numSplitK: 1 numBuffers: 0 numKernels: 1 Tactic: 0x0000000000020429 Time: 0.408869
[02/25/2024-05:14:34] [V] [TRT] Tactic Name: sm80_xmma_gemm_f32f32_f32f32_f32_tn_n_tilesize64x64x8_stage3_warpsize1x4x1_ffma_aligna4_alignc4 numSplitK: 1 numBuffers: 0 numKernels: 1 Tactic: 0x0000000000020285 Time: 0.392192
[02/25/2024-05:14:34] [V] [TRT] Tactic Name: sm80_xmma_gemm_f32f32_f32f32_f32_nn_n_tilesize128x32x8_stage3_warpsize2x2x1_ffma_aligna4_alignc4 numSplitK: 1 numBuffers: 0 numKernels: 1 Tactic: 0x0000000000020317 Time: 0.390875
[02/25/2024-05:14:34] [V] [TRT] Tactic Name: sm80_xmma_gemm_f32f32_f32f32_f32_tn_n_tilesize128x32x8_stage3_warpsize2x2x1_ffma_aligna4_alignc4 numSplitK: 1 numBuffers: 0 numKernels: 1 Tactic: 0x000000000002061f Time: 0.458606
[02/25/2024-05:14:34] [V] [TRT] Tactic Name: sm80_xmma_gemm_f32f32_f32f32_f32_nn_n_tilesize32x32x8_stage3_warpsize1x2x1_ffma_aligna4_alignc4 numSplitK: 1 numBuffers: 0 numKernels: 1 Tactic: 0x00000000000202d8 Time: 0.390729
[02/25/2024-05:14:34] [V] [TRT] Tactic Name: sm80_xmma_gemm_f32f32_tf32f32_f32_nn_n_tilesize64x128x16_stage4_warpsize2x2x1_tensor16x8x8_aligna4_alignc4 numSplitK: 1 numBuffers: 0 numKernels: 1 Tactic: 0x0000000000020332 Time: 0.394971
[02/25/2024-05:14:34] [V] [TRT] Tactic Name: sm80_xmma_gemm_f32f32_tf32f32_f32_tn_n_tilesize64x128x16_stage4_warpsize2x2x1_tensor16x8x8_aligna4_alignc4 numSplitK: 1 numBuffers: 0 numKernels: 1 Tactic: 0x000000000002057e Time: 0.409015
[02/25/2024-05:14:34] [V] [TRT] Tactic Name: sm80_xmma_gemm_f32f32_f32f32_f32_nn_n_tilesize256x64x8_stage3_warpsize2x2x1_ffma_aligna4_alignc4 numSplitK: 1 numBuffers: 0 numKernels: 1 Tactic: 0x00000000000202d2 Time: 0.396256
[02/25/2024-05:14:34] [V] [TRT] Tactic Name: sm80_xmma_gemm_f32f32_f32f32_f32_tn_n_tilesize256x64x8_stage3_warpsize2x2x1_ffma_aligna4_alignc4 numSplitK: 1 numBuffers: 0 numKernels: 1 Tactic: 0x00000000000201ef Time: 0.408581
[02/25/2024-05:14:34] [V] [TRT] Fast skip Tactic:0x0000000000020158 which exceed time limit during pre-run
[02/25/2024-05:14:34] [V] [TRT] Tactic Name: ampere_sgemm_64x32_sliced1x4_nn_v1 numSplitK: 1 numBuffers: 0 numKernels: 1 Tactic: 0x0000000000020158 Time: 1.35373
[02/25/2024-05:14:34] [V] [TRT] Tactic Name: sm80_xmma_gemm_f32f32_f32f32_f32_nn_n_tilesize64x128x8_stage3_warpsize1x4x1_ffma_aligna4_alignc4 numSplitK: 1 numBuffers: 0 numKernels: 1 Tactic: 0x0000000000020103 Time: 0.406089
[02/25/2024-05:14:34] [V] [TRT] Tactic Name: sm80_xmma_gemm_f32f32_f32f32_f32_tn_n_tilesize32x128x8_stage3_warpsize1x2x1_ffma_aligna4_alignc4 numSplitK: 1 numBuffers: 0 numKernels: 1 Tactic: 0x00000000000201f9 Time: 0.494857
[02/25/2024-05:14:34] [V] [TRT] Tactic Name: sm80_xmma_gemm_f32f32_f32f32_f32_nn_n_tilesize32x128x8_stage3_warpsize1x2x1_ffma_aligna4_alignc4 numSplitK: 1 numBuffers: 0 numKernels: 1 Tactic: 0x0000000000020474 Time: 0.442661
[02/25/2024-05:14:34] [V] [TRT] Tactic Name: sm80_xmma_gemm_f32f32_f32f32_f32_tn_n_tilesize64x128x8_stage3_warpsize1x4x1_ffma_aligna4_alignc4 numSplitK: 1 numBuffers: 0 numKernels: 1 Tactic: 0x0000000000020409 Time: 0.470747
[02/25/2024-05:14:34] [V] [TRT] Fast skip Tactic:0x00000000000205e5 which exceed time limit during pre-run
[02/25/2024-05:14:34] [V] [TRT] Tactic Name: ampere_sgemm_64x32_sliced1x4_tn_v1 numSplitK: 1 numBuffers: 0 numKernels: 1 Tactic: 0x00000000000205e5 Time: 1.38957
[02/25/2024-05:14:34] [V] [TRT] Tactic Name: sm80_xmma_gemm_f32f32_f32f32_f32_tn_n_tilesize128x128x8_stage3_warpsize2x2x1_ffma_aligna4_alignc4 numSplitK: 1 numBuffers: 0 numKernels: 1 Tactic: 0x00000000000203be Time: 0.397897
[02/25/2024-05:14:34] [V] [TRT] Tactic Name: sm80_xmma_gemm_f32f32_f32f32_f32_nn_n_tilesize128x128x8_stage3_warpsize2x2x1_ffma_aligna4_alignc4 numSplitK: 1 numBuffers: 0 numKernels: 1 Tactic: 0x00000000000206d2 Time: 0.465627
[02/25/2024-05:14:34] [V] [TRT] MatMul_161 + BatchNormalization_163 + Relu_165 (CaskGemmConvolution[0x8000002e]) profiling completed in 0.33212 seconds. Fastest Tactic: 0x0000000000020231 Time: 0.389998
[02/25/2024-05:14:34] [V] [TRT] --------------- Timing Runner: MatMul_161 + BatchNormalization_163 + Relu_165 (CaskFlattenConvolution[0x80000036])
[02/25/2024-05:14:34] [V] [TRT] CaskFlattenConvolution has no valid tactics for this config, skipping
[02/25/2024-05:14:34] [V] [TRT] --------------- Timing Runner: MatMul_161 + BatchNormalization_163 + Relu_165 (CudnnConvolution[0x80000000])
[02/25/2024-05:14:34] [V] [TRT] CudnnConvolution has no valid tactics for this config, skipping
[02/25/2024-05:14:34] [V] [TRT] >>>>>>>>>>>>>>> Chose Runner Type: CaskGemmConvolution Tactic: 0x0000000000020231
[02/25/2024-05:14:34] [V] [TRT] *************** Autotuning format combination: Float(10,1,10,10) -> Float(64,1,64,64) ***************
[02/25/2024-05:14:34] [V] [TRT] --------------- Timing Runner: MatMul_161 + BatchNormalization_163 + Relu_165 (CaskConvolution[0x80000009])
[02/25/2024-05:14:34] [V] [TRT] Tactic Name: sm80_xmma_fprop_implicit_gemm_indexed_f32f32_f32f32_f32_nhwckrsc_nhwc_tilesize64x64x8_stage3_warpsize1x4x1_g1_ffma_aligna4_alignc4 Tactic: 0x19b688348f983aa0 Time: 0.392046
[02/25/2024-05:14:34] [V] [TRT] Tactic Name: sm80_xmma_fprop_implicit_gemm_indexed_wo_smem_f32f32_tf32f32_f32_nhwckrsc_nhwc_tilesize128x16x32_stage1_warpsize4x1x1_g1_tensor16x8x8_aligna4_alignc4 Tactic: 0xcf8ea142095f02d2 Time: 0.38912
[02/25/2024-05:14:34] [V] [TRT] Tactic Name: sm80_xmma_fprop_implicit_gemm_f32f32_f32f32_f32_nhwckrsc_nhwc_tilesize128x16x8_stage3_warpsize4x1x1_g1_ffma_aligna4_alignc4 Tactic: 0x92ed3100c35fc43e Time: 0.502638
[02/25/2024-05:14:35] [V] [TRT] Tactic Name: ampere_scudnn_128x128_relu_exp_interior_nhwc_tn_v1 Tactic: 0x17173deba0b64484 Time: 0.397019
[02/25/2024-05:14:35] [V] [TRT] Tactic Name: sm80_xmma_fprop_implicit_gemm_f32f32_f32f32_f32_nhwckrsc_nhwc_tilesize128x64x8_stage3_warpsize2x2x1_g1_ffma_t1r1s1_aligna4_alignc4 Tactic: 0x35f26f9c09557d86 Time: 0.395118
[02/25/2024-05:14:35] [V] [TRT] Tactic Name: sm80_xmma_fprop_implicit_gemm_f32f32_f32f32_f32_nhwckrsc_nhwc_tilesize64x64x8_stage3_warpsize1x4x1_g1_ffma_simple_t1r1s1_aligna4_alignc4 Tactic: 0x90898977fc8ce537 Time: 0.392192
[02/25/2024-05:14:35] [V] [TRT] Tactic Name: sm80_xmma_fprop_implicit_gemm_f32f32_f32f32_f32_nhwckrsc_nhwc_tilesize64x128x8_stage3_warpsize1x4x1_g1_ffma_simple_t1r1s1_aligna4_alignc4 Tactic: 0xc7b3afceb5fb03c0 Time: 0.596114
[02/25/2024-05:14:35] [V] [TRT] Tactic Name: sm80_xmma_fprop_implicit_gemm_f32f32_f32f32_f32_nhwckrsc_nhwc_tilesize128x64x8_stage3_warpsize2x2x1_g1_ffma_simple_t1r1s1_aligna4_alignc4 Tactic: 0xd55ee6fd0b56f808 Time: 0.394094
[02/25/2024-05:14:35] [V] [TRT] Tactic Name: sm80_xmma_fprop_implicit_gemm_f32f32_f32f32_f32_nhwckrsc_nhwc_tilesize256x64x8_stage3_warpsize2x2x1_g1_ffma_aligna4_alignc4 Tactic: 0x8014228ec08b4d49 Time: 0.409307
[02/25/2024-05:14:35] [V] [TRT] Tactic Name: sm80_xmma_fprop_implicit_gemm_f32f32_f32f32_f32_nhwckrsc_nhwc_tilesize64x128x8_stage3_warpsize1x4x1_g1_ffma_t1r1s1_aligna4_alignc4 Tactic: 0x1022069e6f8d9aeb Time: 0.659017
[02/25/2024-05:14:35] [V] [TRT] Tactic Name: sm80_xmma_fprop_implicit_gemm_f32f32_f32f32_f32_nhwckrsc_nhwc_tilesize128x64x8_stage3_warpsize2x2x1_g1_ffma_aligna4_alignc4 Tactic: 0x1da91d865428f237 Time: 0.396727
[02/25/2024-05:14:35] [V] [TRT] Tactic Name: sm80_xmma_fprop_implicit_gemm_indexed_f32f32_f32f32_f32_nhwckrsc_nhwc_tilesize128x16x8_stage3_warpsize4x1x1_g1_ffma_aligna4_alignc4 Tactic: 0x4fd3c46622e98342 Time: 0.415159
[02/25/2024-05:14:35] [V] [TRT] Tactic Name: sm80_xmma_fprop_implicit_gemm_f32f32_f32f32_f32_nhwckrsc_nhwc_tilesize256x64x8_stage3_warpsize2x2x1_g1_ffma_simple_t1r1s1_aligna4_alignc4 Tactic: 0xbc0bba0ff1a92939 Time: 0.41589
[02/25/2024-05:14:35] [V] [TRT] Tactic Name: sm80_xmma_fprop_implicit_gemm_f32f32_f32f32_f32_nhwckrsc_nhwc_tilesize128x32x8_stage3_warpsize2x2x1_g1_ffma_simple_t1r1s1_aligna4_alignc4 Tactic: 0xd9eb6ca56ddc3a22 Time: 0.39307
[02/25/2024-05:14:35] [V] [TRT] Tactic Name: sm80_xmma_fprop_implicit_gemm_f32f32_f32f32_f32_nhwckrsc_nhwc_tilesize32x32x8_stage3_warpsize1x2x1_g1_ffma_simple_t1r1s1_aligna4_alignc4 Tactic: 0x1fb90698107bb33a Time: 0.458606
[02/25/2024-05:14:35] [V] [TRT] Tactic Name: sm80_xmma_fprop_implicit_gemm_indexed_wo_smem_f32f32_tf32f32_f32_nhwckrsc_nhwc_tilesize128x32x16_stage1_warpsize4x1x1_g1_tensor16x8x8_aligna4_alignc4 Tactic: 0xf231cca3335919a4 Time: 0.389559
[02/25/2024-05:14:35] [V] [TRT] Tactic Name: sm80_xmma_fprop_implicit_gemm_f32f32_f32f32_f32_nhwckrsc_nhwc_tilesize32x32x8_stage3_warpsize1x2x1_g1_ffma_aligna4_alignc4 Tactic: 0x7121ec1db3f80c67 Time: 0.391616
[02/25/2024-05:14:35] [V] [TRT] Tactic Name: sm80_xmma_fprop_implicit_gemm_f32f32_f32f32_f32_nhwckrsc_nhwc_tilesize64x64x8_stage3_warpsize1x4x1_g1_ffma_t1r1s1_aligna4_alignc4 Tactic: 0x55d80c17b1cd982d Time: 0.457143
[02/25/2024-05:14:35] [V] [TRT] Tactic Name: sm80_xmma_fprop_implicit_gemm_indexed_f32f32_f32f32_f32_nhwckrsc_nhwc_tilesize32x32x8_stage3_warpsize1x2x1_g1_ffma_aligna4_alignc4 Tactic: 0x0a143be7a52f301a Time: 0.389998
[02/25/2024-05:14:35] [V] [TRT] Tactic Name: sm80_xmma_fprop_implicit_gemm_f32f32_f32f32_f32_nhwckrsc_nhwc_tilesize64x64x8_stage3_warpsize1x4x1_g1_ffma_aligna4_alignc4 Tactic: 0x62835fce994f06dd Time: 0.39307
[02/25/2024-05:14:35] [V] [TRT] Tactic Name: sm80_xmma_fprop_implicit_gemm_indexed_f32f32_f32f32_f32_nhwckrsc_nhwc_tilesize128x32x8_stage3_warpsize2x2x1_g1_ffma_aligna4_alignc4 Tactic: 0xa6448a1e79f1ca6f Time: 0.392485
[02/25/2024-05:14:35] [V] [TRT] MatMul_161 + BatchNormalization_163 + Relu_165 (CaskConvolution[0x80000009]) profiling completed in 0.131752 seconds. Fastest Tactic: 0xcf8ea142095f02d2 Time: 0.38912
[02/25/2024-05:14:35] [V] [TRT] --------------- Timing Runner: MatMul_161 + BatchNormalization_163 + Relu_165 (CaskFlattenConvolution[0x80000036])
[02/25/2024-05:14:35] [V] [TRT] CaskFlattenConvolution has no valid tactics for this config, skipping
[02/25/2024-05:14:35] [V] [TRT] --------------- Timing Runner: MatMul_161 + BatchNormalization_163 + Relu_165 (CublasConvolution[0x80000029])
[02/25/2024-05:14:35] [V] [TRT] CublasConvolution has no valid tactics for this config, skipping
[02/25/2024-05:14:35] [V] [TRT] >>>>>>>>>>>>>>> Chose Runner Type: CaskConvolution Tactic: 0xcf8ea142095f02d2
[02/25/2024-05:14:35] [V] [TRT] *************** Autotuning format combination: Float(3,1:4,3,3) -> Float(64,1,1,1) ***************
[02/25/2024-05:14:35] [V] [TRT] --------------- Timing Runner: MatMul_161 + BatchNormalization_163 + Relu_165 (CaskConvolution[0x80000009])
[02/25/2024-05:14:35] [V] [TRT] Tactic Name: sm80_xmma_fprop_implicit_gemm_indexed_f32f32_tf32f32_f32_nhwckrsc_nchw_tilesize128x128x16_stage4_warpsize2x2x1_g1_tensor16x8x8_alignc4 Tactic: 0xe8f7b6a5bab325f8 Time: 1.75323
[02/25/2024-05:14:35] [V] [TRT] Tactic Name: sm80_xmma_fprop_implicit_gemm_f32f32_tf32f32_f32_nhwckrsc_nchw_tilesize128x128x16_stage4_warpsize2x2x1_g1_tensor16x8x8_simple_t1r1s1_alignc4 Tactic: 0x440241d9c93d605d Time: 1.68945
[02/25/2024-05:14:35] [V] [TRT] Tactic Name: sm80_xmma_fprop_implicit_gemm_f32f32_tf32f32_f32_nhwckrsc_nchw_tilesize128x128x16_stage4_warpsize2x2x1_g1_tensor16x8x8_t1r1s1_alignc4 Tactic: 0xc8ad2c0ce0af5623 Time: 1.60197
[02/25/2024-05:14:35] [V] [TRT] Tactic Name: sm80_xmma_fprop_implicit_gemm_f32f32_tf32f32_f32_nhwckrsc_nchw_tilesize128x128x16_stage4_warpsize2x2x1_g1_tensor16x8x8_alignc4 Tactic: 0x9fd9fe001908ce2e Time: 1.68744
[02/25/2024-05:14:35] [V] [TRT] MatMul_161 + BatchNormalization_163 + Relu_165 (CaskConvolution[0x80000009]) profiling completed in 0.0752943 seconds. Fastest Tactic: 0xc8ad2c0ce0af5623 Time: 1.60197
[02/25/2024-05:14:35] [V] [TRT] --------------- Timing Runner: MatMul_161 + BatchNormalization_163 + Relu_165 (CaskFlattenConvolution[0x80000036])
[02/25/2024-05:14:35] [V] [TRT] CaskFlattenConvolution has no valid tactics for this config, skipping
[02/25/2024-05:14:35] [V] [TRT] >>>>>>>>>>>>>>> Chose Runner Type: CaskConvolution Tactic: 0xc8ad2c0ce0af5623
[02/25/2024-05:14:35] [V] [TRT] *************** Autotuning format combination: Float(3,1:4,3,3) -> Float(16,1:4,16,16) ***************
[02/25/2024-05:14:35] [V] [TRT] --------------- Timing Runner: MatMul_161 + BatchNormalization_163 + Relu_165 (CaskConvolution[0x80000009])
[02/25/2024-05:14:35] [V] [TRT] Tactic Name: ampere_scudnn_128x128_ldg4_relu_exp_interior_nhwc_tn_v1 Tactic: 0xe47307053a42b3e4 Time: 0.459337
[02/25/2024-05:14:35] [V] [TRT] Tactic Name: ampere_scudnn_128x128_ldg4_relu_exp_medium_nhwc_tn_v1 Tactic: 0x7bc32c782b800c48 Time: 0.407259
[02/25/2024-05:14:35] [V] [TRT] Tactic Name: ampere_scudnn_128x32_sliced1x4_ldg4_relu_exp_small_nhwc_tn_v1 Tactic: 0x3e2b881168d9689d Time: 0.622007
[02/25/2024-05:14:35] [V] [TRT] Tactic Name: ampere_scudnn_128x128_ldg4_relu_exp_small_nhwc_tn_v1 Tactic: 0xf90060ce8193b811 Time: 0.407406
[02/25/2024-05:14:35] [V] [TRT] Tactic Name: sm80_xmma_fprop_implicit_gemm_indexed_wo_smem_f32f32_tf32f32_f32_nhwckrsc_nhwc_tilesize128x16x32_stage1_warpsize4x1x1_g1_tensor16x8x8_alignc8 Tactic: 0x96467934a22da27d Time: 0.399506
[02/25/2024-05:14:35] [V] [TRT] Tactic Name: ampere_scudnn_128x32_sliced1x4_ldg4_relu_exp_interior_nhwc_tn_v1 Tactic: 0xc7feb33970feefa7 Time: 0.636635
[02/25/2024-05:14:35] [V] [TRT] Tactic Name: sm80_xmma_fprop_implicit_gemm_indexed_wo_smem_f32f32_tf32f32_f32_nhwckrsc_nhwc_tilesize128x32x64_stage1_warpsize4x1x1_g1_tensor16x8x8_aligna8 Tactic: 0x9355e195cee05798 Time: 0.401262
[02/25/2024-05:14:35] [V] [TRT] Tactic Name: sm80_xmma_fprop_implicit_gemm_indexed_wo_smem_f32f32_tf32f32_f32_nhwckrsc_nhwc_tilesize128x32x64_stage1_warpsize4x1x1_g1_tensor16x8x8_alignc8 Tactic: 0x3a8712b17741b582 Time: 0.400091
[02/25/2024-05:14:35] [V] [TRT] Tactic Name: sm80_xmma_fprop_implicit_gemm_indexed_wo_smem_f32f32_tf32f32_f32_nhwckrsc_nhwc_tilesize128x16x32_stage1_warpsize4x1x1_g1_tensor16x8x8_aligna4 Tactic: 0xb3e5ce9d1b1da232 Time: 0.399671
[02/25/2024-05:14:35] [V] [TRT] Tactic Name: ampere_scudnn_128x64_sliced1x2_ldg4_relu_exp_interior_nhwc_tn_v1 Tactic: 0xae0c89d047932ba3 Time: 0.401993
[02/25/2024-05:14:35] [V] [TRT] Tactic Name: sm80_xmma_fprop_implicit_gemm_indexed_wo_smem_f32f32_tf32f32_f32_nhwckrsc_nhwc_tilesize128x32x64_stage1_warpsize4x1x1_g1_tensor16x8x8_alignc4 Tactic: 0xb6f6563c77d057d7 Time: 0.400224
[02/25/2024-05:14:35] [V] [TRT] Tactic Name: sm80_xmma_fprop_implicit_gemm_indexed_wo_smem_f32f32_tf32f32_f32_nhwckrsc_nhwc_tilesize128x16x64_stage1_warpsize4x1x1_g1_tensor16x8x8_aligna8 Tactic: 0xe9e5475c77d60638 Time: 0.400969
[02/25/2024-05:14:35] [V] [TRT] Tactic Name: sm80_xmma_fprop_implicit_gemm_indexed_wo_smem_f32f32_tf32f32_f32_nhwckrsc_nhwc_tilesize128x16x32_stage1_warpsize4x1x1_g1_tensor16x8x8_aligna4_alignc8 Tactic: 0x43ffe5cf09cee087 Time: 0.398482
[02/25/2024-05:14:35] [V] [TRT] Tactic Name: sm80_xmma_fprop_implicit_gemm_indexed_wo_smem_f32f32_tf32f32_f32_nhwckrsc_nhwc_tilesize128x16x32_stage1_warpsize4x1x1_g1_tensor16x8x8_aligna8_alignc8 Tactic: 0x4640eb34c8ecc700 Time: 0.412233
[02/25/2024-05:14:35] [V] [TRT] Tactic Name: sm80_xmma_fprop_implicit_gemm_indexed_wo_smem_f32f32_tf32f32_f32_nhwckrsc_nhwc_tilesize128x16x32_stage1_warpsize4x1x1_g1_tensor16x8x8_aligna8 Tactic: 0x3f948a101b8c4067 Time: 0.399653
[02/25/2024-05:14:35] [V] [TRT] Tactic Name: sm80_xmma_fprop_implicit_gemm_indexed_wo_smem_f32f32_tf32f32_f32_nhwckrsc_nhwc_tilesize128x32x16_stage1_warpsize4x1x1_g1_tensor16x8x8_alignc4 Tactic: 0xfed494d61b2087ba Time: 0.398921
[02/25/2024-05:14:35] [V] [TRT] Tactic Name: sm80_xmma_fprop_implicit_gemm_indexed_wo_smem_f32f32_tf32f32_f32_nhwckrsc_nhwc_tilesize128x32x16_stage1_warpsize4x1x1_g1_tensor16x8x8_alignc8 Tactic: 0x72a5d05b1bb165ef Time: 0.460361
[02/25/2024-05:14:35] [V] [TRT] Tactic Name: sm80_xmma_fprop_implicit_gemm_indexed_wo_smem_f32f32_tf32f32_f32_nhwckrsc_nhwc_tilesize128x32x16_stage1_warpsize4x1x1_g1_tensor16x8x8 Tactic: 0x9cb304e2edbc1221 Time: 0.39936
[02/25/2024-05:14:35] [V] [TRT] Tactic Name: sm80_xmma_fprop_implicit_gemm_indexed_wo_smem_f32f32_tf32f32_f32_nhwckrsc_nhwc_tilesize128x32x16_stage1_warpsize4x1x1_g1_tensor16x8x8_aligna8_alignc4 Tactic: 0xf78ec258f27b3e23 Time: 0.399506
[02/25/2024-05:14:35] [V] [TRT] Tactic Name: sm80_xmma_fprop_implicit_gemm_f32f32_tf32f32_f32_nhwckrsc_nhwc_tilesize128x128x16_stage4_warpsize2x2x1_g1_tensor16x8x8_t1r1s1 Tactic: 0x130df49cb195156b Time: 0.50293
[02/25/2024-05:14:35] [V] [TRT] Tactic Name: sm80_xmma_fprop_implicit_gemm_f32f32_tf32f32_f32_nhwckrsc_nhwc_tilesize128x128x16_stage4_warpsize2x2x1_g1_tensor16x8x8_simple_t1r1s1 Tactic: 0x9dece0dc37e90462 Time: 0.425838
[02/25/2024-05:14:35] [V] [TRT] Tactic Name: sm80_xmma_fprop_implicit_gemm_indexed_wo_smem_f32f32_tf32f32_f32_nhwckrsc_nhwc_tilesize128x32x64_stage1_warpsize4x1x1_g1_tensor16x8x8_aligna4_alignc8 Tactic: 0x1acd4f006848c62b Time: 0.476599
[02/25/2024-05:14:35] [V] [TRT] Tactic Name: sm80_xmma_fprop_implicit_gemm_f32f32_tf32f32_f32_nhwckrsc_nhwc_tilesize128x128x16_stage4_warpsize2x2x1_g1_tensor16x8x8 Tactic: 0xb443c221fcb1565b Time: 0.425691
[02/25/2024-05:14:35] [V] [TRT] Tactic Name: sm80_xmma_fprop_implicit_gemm_indexed_wo_smem_f32f32_tf32f32_f32_nhwckrsc_nhwc_tilesize128x16x64_stage1_warpsize4x1x1_g1_tensor16x8x8_alignc4 Tactic: 0xcc46f0f5cee60677 Time: 0.398629
[02/25/2024-05:14:35] [V] [TRT] Tactic Name: sm80_xmma_fprop_implicit_gemm_indexed_wo_smem_f32f32_tf32f32_f32_nhwckrsc_nhwc_tilesize128x32x16_stage1_warpsize4x1x1_g1_tensor16x8x8_aligna4_alignc8 Tactic: 0x7e40882e33c8fbf1 Time: 0.46987
[02/25/2024-05:14:35] [V] [TRT] Tactic Name: sm80_xmma_fprop_implicit_gemm_indexed_wo_smem_f32f32_tf32f32_f32_nhwckrsc_nhwc_tilesize128x16x64_stage1_warpsize4x1x1_g1_tensor16x8x8_alignc8 Tactic: 0x4037b478ce77e422 Time: 0.400677
[02/25/2024-05:14:35] [V] [TRT] Tactic Name: sm80_xmma_fprop_implicit_gemm_indexed_wo_smem_f32f32_tf32f32_f32_nhwckrsc_nhwc_tilesize128x16x32_stage1_warpsize4x1x1_g1_tensor16x8x8_alignc4 Tactic: 0x1a373db9a2bc4028 Time: 0.40053
[02/25/2024-05:14:35] [V] [TRT] Tactic Name: sm80_xmma_fprop_implicit_gemm_indexed_wo_smem_f32f32_tf32f32_f32_nhwckrsc_nhwc_tilesize128x16x64_stage1_warpsize4x1x1_g1_tensor16x8x8 Tactic: 0x10383a0781d24dde Time: 0.398921
[02/25/2024-05:14:35] [V] [TRT] Tactic Name: sm80_xmma_fprop_implicit_gemm_indexed_wo_smem_f32f32_tf32f32_f32_nhwckrsc_nhwc_tilesize128x32x16_stage1_warpsize4x1x1_g1_tensor16x8x8_aligna8_alignc8 Tactic: 0x7bff86d5f2eadc76 Time: 0.400384
[02/25/2024-05:14:35] [V] [TRT] Tactic Name: sm80_xmma_fprop_implicit_gemm_indexed_wo_smem_f32f32_tf32f32_f32_nhwckrsc_nhwc_tilesize128x32x64_stage1_warpsize4x1x1_g1_tensor16x8x8 Tactic: 0xb33296dda7141c64 Time: 0.399945
[02/25/2024-05:14:35] [V] [TRT] Tactic Name: sm80_xmma_fprop_implicit_gemm_indexed_wo_smem_f32f32_tf32f32_f32_nhwckrsc_nhwc_tilesize128x32x16_stage1_warpsize4x1x1_g1_tensor16x8x8_aligna4 Tactic: 0x570667f2a28165a0 Time: 0.399067
[02/25/2024-05:14:35] [V] [TRT] Tactic Name: sm80_xmma_fprop_implicit_gemm_indexed_wo_smem_f32f32_tf32f32_f32_nhwckrsc_nhwc_tilesize128x32x64_stage1_warpsize4x1x1_g1_tensor16x8x8_aligna8_alignc4 Tactic: 0x93030576a9fb03f9 Time: 0.406368
[02/25/2024-05:14:35] [V] [TRT] Tactic Name: sm80_xmma_fprop_implicit_gemm_indexed_f32f32_tf32f32_f32_nhwckrsc_nhwc_tilesize128x128x16_stage4_warpsize2x2x1_g1_tensor16x8x8 Tactic: 0x65e41d81f093b482 Time: 0.422766
[02/25/2024-05:14:35] [V] [TRT] Tactic Name: sm80_xmma_fprop_implicit_gemm_indexed_wo_smem_f32f32_tf32f32_f32_nhwckrsc_nhwc_tilesize128x16x64_stage1_warpsize4x1x1_g1_tensor16x8x8_aligna4_alignc8 Tactic: 0x22cadc265a3b2e32 Time: 0.482011
[02/25/2024-05:14:35] [V] [TRT] Tactic Name: sm80_xmma_fprop_implicit_gemm_indexed_wo_smem_f32f32_tf32f32_f32_nhwckrsc_nhwc_tilesize128x16x64_stage1_warpsize4x1x1_g1_tensor16x8x8_aligna8_alignc4 Tactic: 0xab0496509b88ebe0 Time: 0.400091
[02/25/2024-05:14:35] [V] [TRT] Tactic Name: sm80_xmma_fprop_implicit_gemm_indexed_wo_smem_f32f32_tf32f32_f32_nhwckrsc_nhwc_tilesize128x32x16_stage1_warpsize4x1x1_g1_tensor16x8x8_aligna8 Tactic: 0xdb77237fa21087f5 Time: 0.40053
[02/25/2024-05:14:35] [V] [TRT] Tactic Name: sm80_xmma_fprop_implicit_gemm_indexed_wo_smem_f32f32_tf32f32_f32_nhwckrsc_nhwc_tilesize128x16x32_stage1_warpsize4x1x1_g1_tensor16x8x8 Tactic: 0xae48d3ccfe1edfcd Time: 0.398775
[02/25/2024-05:14:35] [V] [TRT] MatMul_161 + BatchNormalization_163 + Relu_165 (CaskConvolution[0x80000009]) profiling completed in 0.221566 seconds. Fastest Tactic: 0x43ffe5cf09cee087 Time: 0.398482
[02/25/2024-05:14:35] [V] [TRT] MatMul_161 + BatchNormalization_163 + Relu_165: 32 available tactics, 0 unparsable, 16 pruned, 16 remaining after tactic pruning.
[02/25/2024-05:14:35] [V] [TRT] --------------- Timing Runner: MatMul_161 + BatchNormalization_163 + Relu_165 (CaskGemmConvolution[0x8000002e])
[02/25/2024-05:14:35] [V] [TRT] Tactic Name: sm80_xmma_gemm_f32f32_tf32f32_f32_nn_n_tilesize64x128x16_stage4_warpsize2x2x1_tensor16x8x8 numSplitK: 1 numBuffers: 0 numKernels: 1 Tactic: 0x00000000000205c4 Time: 0.400809
[02/25/2024-05:14:35] [V] [TRT] Tactic Name: sm80_xmma_gemm_f32f32_tf32f32_f32_tn_n_tilesize64x128x16_stage4_warpsize2x2x1_tensor16x8x8 numSplitK: 1 numBuffers: 0 numKernels: 1 Tactic: 0x00000000000203a3 Time: 0.400969
[02/25/2024-05:14:35] [V] [TRT] Tactic Name: sm80_xmma_gemm_f32f32_tf32f32_f32_nn_n_tilesize32x32x64_stage3_warpsize2x1x2_tensor16x8x8 numSplitK: 1 numBuffers: 0 numKernels: 1 Tactic: 0x00000000000202fa Time: 0.760101
[02/25/2024-05:14:35] [V] [TRT] Tactic Name: sm80_xmma_gemm_f32f32_tf32f32_f32_tn_n_tilesize32x32x64_stage3_warpsize2x1x2_tensor16x8x8 numSplitK: 1 numBuffers: 0 numKernels: 1 Tactic: 0x00000000000203c4 Time: 0.714606
[02/25/2024-05:14:35] [V] [TRT] Tactic Name: sm80_xmma_gemm_f32f32_tf32f32_f32_tn_n_tilesize128x64x16_stage6_warpsize2x2x1_tensor16x8x8 numSplitK: 1 numBuffers: 0 numKernels: 1 Tactic: 0x0000000000020708 Time: 0.401408
[02/25/2024-05:14:35] [V] [TRT] Tactic Name: sm80_xmma_gemm_f32f32_tf32f32_f32_nn_n_tilesize128x64x16_stage6_warpsize2x2x1_tensor16x8x8 numSplitK: 1 numBuffers: 0 numKernels: 1 Tactic: 0x0000000000020541 Time: 0.400969
[02/25/2024-05:14:35] [V] [TRT] Tactic Name: sm86_xmma_gemm_f32f32_tf32f32_f32_tn_n_tilesize128x128x16_stage3_warpsize2x2x1_tensor16x8x8 numSplitK: 1 numBuffers: 0 numKernels: 1 Tactic: 0x000000000002055c Time: 0.40053
[02/25/2024-05:14:35] [V] [TRT] Tactic Name: sm86_xmma_gemm_f32f32_tf32f32_f32_nn_n_tilesize128x128x16_stage3_warpsize2x2x1_tensor16x8x8 numSplitK: 1 numBuffers: 0 numKernels: 1 Tactic: 0x000000000002039b Time: 0.463287
[02/25/2024-05:14:35] [V] [TRT] Tactic Name: sm80_xmma_gemm_f32f32_tf32f32_f32_tn_n_tilesize128x128x16_stage4_warpsize2x2x1_tensor16x8x8 numSplitK: 1 numBuffers: 0 numKernels: 1 Tactic: 0x0000000000020264 Time: 0.401262
[02/25/2024-05:14:35] [V] [TRT] Tactic Name: sm80_xmma_gemm_f32f32_tf32f32_f32_nn_n_tilesize128x128x16_stage4_warpsize2x2x1_tensor16x8x8 numSplitK: 1 numBuffers: 0 numKernels: 1 Tactic: 0x0000000000020277 Time: 0.400677
[02/25/2024-05:14:35] [V] [TRT] Tactic Name: sm80_xmma_gemm_f32f32_tf32f32_f32_tn_n_tilesize64x32x64_stage4_warpsize2x1x2_tensor16x8x8 numSplitK: 1 numBuffers: 0 numKernels: 1 Tactic: 0x00000000000202ba Time: 0.80779
[02/25/2024-05:14:35] [V] [TRT] Tactic Name: sm80_xmma_gemm_f32f32_tf32f32_f32_nn_n_tilesize64x32x64_stage4_warpsize2x1x2_tensor16x8x8 numSplitK: 1 numBuffers: 0 numKernels: 1 Tactic: 0x0000000000020321 Time: 0.782482
[02/25/2024-05:14:35] [V] [TRT] Tactic Name: sm86_xmma_gemm_f32f32_tf32f32_f32_nn_n_tilesize128x64x32_stage4_warpsize2x2x1_tensor16x8x8 numSplitK: 1 numBuffers: 0 numKernels: 1 Tactic: 0x00000000000202d0 Time: 0.434766
[02/25/2024-05:14:35] [V] [TRT] Tactic Name: sm86_xmma_gemm_f32f32_tf32f32_f32_tn_n_tilesize128x64x32_stage4_warpsize2x2x1_tensor16x8x8 numSplitK: 1 numBuffers: 0 numKernels: 1 Tactic: 0x00000000000202fe Time: 0.401554
[02/25/2024-05:14:35] [V] [TRT] Tactic Name: sm86_xmma_gemm_f32f32_tf32f32_f32_tn_n_tilesize256x64x32_stage2_warpsize4x1x1_tensor16x8x8 numSplitK: 1 numBuffers: 0 numKernels: 1 Tactic: 0x0000000000020387 Time: 0.408576
[02/25/2024-05:14:35] [V] [TRT] Tactic Name: sm86_xmma_gemm_f32f32_tf32f32_f32_nn_n_tilesize256x64x32_stage2_warpsize4x1x1_tensor16x8x8 numSplitK: 1 numBuffers: 0 numKernels: 1 Tactic: 0x0000000000020773 Time: 0.409893
[02/25/2024-05:14:35] [V] [TRT] MatMul_161 + BatchNormalization_163 + Relu_165 (CaskGemmConvolution[0x8000002e]) profiling completed in 0.0976326 seconds. Fastest Tactic: 0x000000000002055c Time: 0.40053
[02/25/2024-05:14:35] [V] [TRT] --------------- Timing Runner: MatMul_161 + BatchNormalization_163 + Relu_165 (CaskFlattenConvolution[0x80000036])
[02/25/2024-05:14:35] [V] [TRT] CaskFlattenConvolution has no valid tactics for this config, skipping
[02/25/2024-05:14:35] [V] [TRT] --------------- Timing Runner: MatMul_161 + BatchNormalization_163 + Relu_165 (CublasConvolution[0x80000029])
[02/25/2024-05:14:35] [V] [TRT] CublasConvolution has no valid tactics for this config, skipping
[02/25/2024-05:14:35] [V] [TRT] >>>>>>>>>>>>>>> Chose Runner Type: CaskConvolution Tactic: 0x43ffe5cf09cee087
[02/25/2024-05:14:35] [V] [TRT] *************** Autotuning format combination: Half(10,1,1,1) -> Half(64,1,1,1) ***************
[02/25/2024-05:14:35] [V] [TRT] --------------- Timing Runner: MatMul_161 + BatchNormalization_163 + Relu_165 (CaskConvolution[0x80000009])
[02/25/2024-05:14:35] [V] [TRT] CaskConvolution has no valid tactics for this config, skipping
[02/25/2024-05:14:35] [V] [TRT] --------------- Timing Runner: MatMul_161 + BatchNormalization_163 + Relu_165 (CublasConvolution[0x80000029])
[02/25/2024-05:14:35] [V] [TRT] CublasConvolution has no valid tactics for this config, skipping
[02/25/2024-05:14:35] [V] [TRT] MatMul_161 + BatchNormalization_163 + Relu_165: 54 available tactics, 0 unparsable, 27 pruned, 27 remaining after tactic pruning.
[02/25/2024-05:14:35] [V] [TRT] --------------- Timing Runner: MatMul_161 + BatchNormalization_163 + Relu_165 (CaskGemmConvolution[0x8000002e])
[02/25/2024-05:14:35] [V] [TRT] Tactic Name: sm80_xmma_gemm_f16f16_f32f32_f32_tn_n_tilesize64x32x8_stage3_warpsize1x2x1_ffma_aligna2_alignc2 numSplitK: 1 numBuffers: 0 numKernels: 1 Tactic: 0x000000000002033b Time: 0.310272
[02/25/2024-05:14:35] [V] [TRT] Tactic Name: sm80_xmma_gemm_f16f16_f32f32_f32_tn_n_tilesize32x32x8_stage3_warpsize1x2x1_ffma_aligna2_alignc2 numSplitK: 1 numBuffers: 0 numKernels: 1 Tactic: 0x00000000000201da Time: 0.264654
[02/25/2024-05:14:35] [V] [TRT] Tactic Name: sm80_xmma_gemm_f16f16_f32f32_f32_nn_n_tilesize64x32x8_stage3_warpsize1x2x1_ffma_aligna2_alignc2 numSplitK: 1 numBuffers: 0 numKernels: 1 Tactic: 0x000000000002065d Time: 0.261851
[02/25/2024-05:14:35] [V] [TRT] Tactic Name: sm80_xmma_gemm_f16f16_f32f32_f32_nn_n_tilesize32x64x8_stage3_warpsize1x2x1_ffma_aligna2_alignc2 numSplitK: 1 numBuffers: 0 numKernels: 1 Tactic: 0x0000000000020268 Time: 0.329742
[02/25/2024-05:14:35] [V] [TRT] Tactic Name: sm80_xmma_gemm_f16f16_f32f32_f32_tn_n_tilesize32x64x8_stage3_warpsize1x2x1_ffma_aligna2_alignc2 numSplitK: 1 numBuffers: 0 numKernels: 1 Tactic: 0x0000000000020471 Time: 0.266679
[02/25/2024-05:14:35] [V] [TRT] Tactic Name: sm80_xmma_gemm_f16f16_f32f32_f32_nn_n_tilesize32x32x8_stage3_warpsize1x2x1_ffma_aligna2_alignc2 numSplitK: 1 numBuffers: 0 numKernels: 1 Tactic: 0x00000000000203de Time: 0.278674
[02/25/2024-05:14:35] [V] [TRT] Tactic Name: sm80_xmma_gemm_f16f16_f32f32_f32_nn_n_tilesize64x64x8_stage3_warpsize1x4x1_ffma_aligna2_alignc2 numSplitK: 1 numBuffers: 0 numKernels: 1 Tactic: 0x00000000000203e4 Time: 0.222501
[02/25/2024-05:14:35] [V] [TRT] Tactic Name: sm80_xmma_gemm_f16f16_f32f32_f32_tn_n_tilesize64x64x8_stage3_warpsize1x4x1_ffma_aligna2_alignc2 numSplitK: 1 numBuffers: 0 numKernels: 1 Tactic: 0x0000000000020603 Time: 0.21899
[02/25/2024-05:14:35] [V] [TRT] Tactic Name: sm80_xmma_gemm_f16f16_f32f32_f32_nn_n_tilesize128x32x8_stage3_warpsize2x2x1_ffma_aligna2_alignc2 numSplitK: 1 numBuffers: 0 numKernels: 1 Tactic: 0x00000000000204fa Time: 0.257902
[02/25/2024-05:14:35] [V] [TRT] Tactic Name: sm80_xmma_gemm_f16f16_f32f32_f32_tn_n_tilesize128x32x8_stage3_warpsize2x2x1_ffma_aligna2_alignc2 numSplitK: 1 numBuffers: 0 numKernels: 1 Tactic: 0x000000000002050d Time: 0.252782
[02/25/2024-05:14:35] [V] [TRT] Tactic Name: sm80_xmma_gemm_f16f16_f32f32_f32_tn_n_tilesize128x64x8_stage3_warpsize2x2x1_ffma_aligna2_alignc2 numSplitK: 1 numBuffers: 0 numKernels: 1 Tactic: 0x00000000000205d8 Time: 0.247662
[02/25/2024-05:14:35] [V] [TRT] Tactic Name: sm80_xmma_gemm_f16f16_f32f32_f32_nn_n_tilesize128x64x8_stage3_warpsize2x2x1_ffma_aligna2_alignc2 numSplitK: 1 numBuffers: 0 numKernels: 1 Tactic: 0x0000000000020309 Time: 0.260233
[02/25/2024-05:14:35] [V] [TRT] Tactic Name: sm80_xmma_gemm_f16f16_f32f32_f32_nn_n_tilesize32x128x8_stage3_warpsize1x2x1_ffma_aligna2_alignc2 numSplitK: 1 numBuffers: 0 numKernels: 1 Tactic: 0x000000000002062d Time: 0.546085
[02/25/2024-05:14:35] [V] [TRT] Tactic Name: sm80_xmma_gemm_f16f16_f32f32_f32_tn_n_tilesize32x128x8_stage3_warpsize1x2x1_ffma_aligna2_alignc2 numSplitK: 1 numBuffers: 0 numKernels: 1 Tactic: 0x0000000000020990 Time: 0.483328
[02/25/2024-05:14:35] [V] [TRT] Tactic Name: sm80_xmma_gemm_f16f16_f32f32_f32_tn_n_tilesize64x128x8_stage3_warpsize1x4x1_ffma_aligna2_alignc2 numSplitK: 1 numBuffers: 0 numKernels: 1 Tactic: 0x0000000000020372 Time: 0.441344
[02/25/2024-05:14:35] [V] [TRT] Tactic Name: sm80_xmma_gemm_f16f16_f32f32_f32_nn_n_tilesize64x128x8_stage3_warpsize1x4x1_ffma_aligna2_alignc2 numSplitK: 1 numBuffers: 0 numKernels: 1 Tactic: 0x00000000000209f8 Time: 0.514779
[02/25/2024-05:14:35] [V] [TRT] Tactic Name: ampere_hgemm_128x64_tn_v0 numSplitK: 1 numBuffers: 0 numKernels: 1 Tactic: 0x00000000000201e7 Time: 0.562615
[02/25/2024-05:14:35] [V] [TRT] Tactic Name: ampere_hgemm_128x64_nn_v0 numSplitK: 1 numBuffers: 0 numKernels: 1 Tactic: 0x0000000000020620 Time: 0.561006
[02/25/2024-05:14:35] [V] [TRT] Tactic Name: sm80_xmma_gemm_f16f16_f32f32_f32_nn_n_tilesize256x64x8_stage3_warpsize2x2x1_ffma_aligna2_alignc2 numSplitK: 1 numBuffers: 0 numKernels: 1 Tactic: 0x0000000000020628 Time: 0.239762
[02/25/2024-05:14:35] [V] [TRT] Tactic Name: sm80_xmma_gemm_f16f16_f32f32_f32_tn_n_tilesize256x64x8_stage3_warpsize2x2x1_ffma_aligna2_alignc2 numSplitK: 1 numBuffers: 0 numKernels: 1 Tactic: 0x00000000000206e2 Time: 0.253074
[02/25/2024-05:14:35] [V] [TRT] Tactic Name: sm80_xmma_gemm_f16f16_f16f16_f16_nn_n_tilesize32x32x64_stage6_warpsize2x2x1_tensor16x8x16_aligna2_alignc2 numSplitK: 1 numBuffers: 0 numKernels: 1 Tactic: 0x00000000000206e1 Time: 0.777655
[02/25/2024-05:14:35] [V] [TRT] Tactic Name: sm80_xmma_gemm_f16f16_f16f16_f16_tn_n_tilesize32x32x64_stage6_warpsize2x2x1_tensor16x8x16_aligna2_alignc2 numSplitK: 1 numBuffers: 0 numKernels: 1 Tactic: 0x0000000000020530 Time: 0.850651
[02/25/2024-05:14:35] [V] [TRT] Tactic Name: sm80_xmma_gemm_f16f16_f32f32_f32_nn_n_tilesize128x128x8_stage3_warpsize2x2x1_ffma_aligna2_alignc2 numSplitK: 1 numBuffers: 0 numKernels: 1 Tactic: 0x00000000000205e7 Time: 0.367031
[02/25/2024-05:14:35] [V] [TRT] Tactic Name: sm80_xmma_gemm_f16f16_f32f32_f32_tn_n_tilesize128x128x8_stage3_warpsize2x2x1_ffma_aligna2_alignc2 numSplitK: 1 numBuffers: 0 numKernels: 1 Tactic: 0x00000000000202ca Time: 0.44208
[02/25/2024-05:14:35] [V] [TRT] Tactic Name: ampere_hgemm_128x128_nn_v0 numSplitK: 1 numBuffers: 0 numKernels: 1 Tactic: 0x000000000002014d Time: 0.550446
[02/25/2024-05:14:35] [V] [TRT] Tactic Name: ampere_hgemm_128x128_tn_v0 numSplitK: 1 numBuffers: 0 numKernels: 1 Tactic: 0x00000000000208cd Time: 0.550473
[02/25/2024-05:14:35] [V] [TRT] Tactic Name: sm80_xmma_gemm_f16f16_f16f16_f16_tn_n_tilesize128x64x32_stage5_warpsize2x2x1_tensor16x8x16_aligna2_alignc2 numSplitK: 1 numBuffers: 0 numKernels: 1 Tactic: 0x000000000002071f Time: 0.34187
[02/25/2024-05:14:35] [V] [TRT] MatMul_161 + BatchNormalization_163 + Relu_165 (CaskGemmConvolution[0x8000002e]) profiling completed in 0.273978 seconds. Fastest Tactic: 0x0000000000020603 Time: 0.21899
[02/25/2024-05:14:35] [V] [TRT] --------------- Timing Runner: MatMul_161 + BatchNormalization_163 + Relu_165 (CaskFlattenConvolution[0x80000036])
[02/25/2024-05:14:35] [V] [TRT] CaskFlattenConvolution has no valid tactics for this config, skipping
[02/25/2024-05:14:35] [V] [TRT] --------------- Timing Runner: MatMul_161 + BatchNormalization_163 + Relu_165 (CudnnConvolution[0x80000000])
[02/25/2024-05:14:35] [V] [TRT] CudnnConvolution has no valid tactics for this config, skipping
[02/25/2024-05:14:35] [V] [TRT] >>>>>>>>>>>>>>> Chose Runner Type: CaskGemmConvolution Tactic: 0x0000000000020603
[02/25/2024-05:14:35] [V] [TRT] *************** Autotuning format combination: Half(5,1:2,1,1) -> Half(32,1:2,1,1) ***************
[02/25/2024-05:14:35] [V] [TRT] --------------- Timing Runner: MatMul_161 + BatchNormalization_163 + Relu_165 (CublasConvolution[0x80000029])
[02/25/2024-05:14:35] [V] [TRT] CublasConvolution has no valid tactics for this config, skipping
[02/25/2024-05:14:35] [V] [TRT] *************** Autotuning format combination: Half(5,1:2,5,5) -> Half(32,1:2,32,32) ***************
[02/25/2024-05:14:35] [V] [TRT] --------------- Timing Runner: MatMul_161 + BatchNormalization_163 + Relu_165 (CaskConvolution[0x80000009])
[02/25/2024-05:14:35] [V] [TRT] Tactic Name: sm80_xmma_fprop_implicit_gemm_indexed_wo_smem_f16f16_f16f16_f16_nhwckrsc_nhwc_tilesize128x32x64_stage1_warpsize4x1x1_g1_tensor16x8x16_aligna2_alignc4 Tactic: 0x6a76904d34985d11 Time: 0.281746
[02/25/2024-05:14:35] [V] [TRT] Tactic Name: sm80_xmma_fprop_implicit_gemm_indexed_wo_smem_f16f16_f16f16_f16_nhwckrsc_nhwc_tilesize128x32x16_stage1_warpsize4x1x1_g1_tensor16x8x16_aligna2_alignc4 Tactic: 0xb97671b320ea2fbb Time: 0.196608
[02/25/2024-05:14:35] [V] [TRT] Tactic Name: sm80_xmma_fprop_implicit_gemm_indexed_wo_smem_f16f16_f16f16_f16_nhwckrsc_nhwc_tilesize128x32x64_stage1_warpsize4x1x1_g1_tensor16x8x16_aligna2_alignc2 Tactic: 0xe522659e6357a379 Time: 0.362496
[02/25/2024-05:14:35] [V] [TRT] Tactic Name: sm80_xmma_fprop_implicit_gemm_indexed_wo_smem_f16f16_f16f16_f16_nhwckrsc_nhwc_tilesize128x16x64_stage1_warpsize4x1x1_g1_tensor16x8x16_aligna4_alignc2 Tactic: 0x17bdd86adff94950 Time: 0.366153
[02/25/2024-05:14:35] [V] [TRT] Tactic Name: sm80_xmma_fprop_implicit_gemm_indexed_wo_smem_f16f16_f16f16_f16_nhwckrsc_nhwc_tilesize128x16x32_stage1_warpsize4x1x1_g1_tensor16x8x16_aligna2_alignc4 Tactic: 0xd405f38f8e89fab2 Time: 0.24533
[02/25/2024-05:14:35] [V] [TRT] Tactic Name: sm80_xmma_fprop_implicit_gemm_indexed_wo_smem_f16f16_f16f16_f16_nhwckrsc_nhwc_tilesize128x32x16_stage1_warpsize4x1x1_g1_tensor16x8x16_aligna2_alignc2 Tactic: 0x362284607725d1d3 Time: 0.362789
[02/25/2024-05:14:35] [V] [TRT] Tactic Name: sm80_xmma_fprop_implicit_gemm_indexed_wo_smem_f16f16_f16f16_f16_nhwckrsc_nhwc_tilesize128x32x16_stage1_warpsize4x1x1_g1_tensor16x8x16_aligna4_alignc2 Tactic: 0xfd9154884033cd52 Time: 0.381367
[02/25/2024-05:14:35] [V] [TRT] Tactic Name: sm80_xmma_fprop_implicit_gemm_indexed_wo_smem_f16f16_f16f16_f16_nhwckrsc_nhwc_tilesize128x32x64_stage1_warpsize4x1x1_g1_tensor16x8x16_aligna4_alignc4 Tactic: 0xa1c540a5038e4190 Time: 0.202459
[02/25/2024-05:14:35] [V] [TRT] Tactic Name: sm80_xmma_fprop_implicit_gemm_indexed_wo_smem_f16f16_f16f16_f16_nhwckrsc_nhwc_tilesize128x16x32_stage1_warpsize4x1x1_g1_tensor16x8x16_aligna4_alignc2 Tactic: 0x90e2d6b4ee50185b Time: 0.355744
[02/25/2024-05:14:35] [V] [TRT] Tactic Name: sm80_xmma_fprop_implicit_gemm_indexed_wo_smem_f16f16_f16f16_f16_nhwckrsc_nhwc_tilesize128x16x64_stage1_warpsize4x1x1_g1_tensor16x8x16_aligna4_alignc4 Tactic: 0x98e92db98836b738 Time: 0.23552
[02/25/2024-05:14:35] [V] [TRT] Tactic Name: sm80_xmma_fprop_implicit_gemm_indexed_wo_smem_f16f16_f16f16_f16_nhwckrsc_nhwc_tilesize128x16x64_stage1_warpsize4x1x1_g1_tensor16x8x16_aligna2_alignc4 Tactic: 0x535afd51bf20abb9 Time: 0.366592
[02/25/2024-05:14:35] [V] [TRT] Tactic Name: sm80_xmma_fprop_implicit_gemm_indexed_wo_smem_f16f16_f16f16_f16_nhwckrsc_nhwc_tilesize128x32x64_stage1_warpsize4x1x1_g1_tensor16x8x16_aligna4_alignc2 Tactic: 0x2e91b5765441bff8 Time: 0.318318
[02/25/2024-05:14:35] [V] [TRT] Tactic Name: sm80_xmma_fprop_implicit_gemm_indexed_wo_smem_f16f16_f16f16_f16_nhwckrsc_nhwc_tilesize128x16x32_stage1_warpsize4x1x1_g1_tensor16x8x16_aligna2_alignc2 Tactic: 0x5b51065cd94604da Time: 0.373029
[02/25/2024-05:14:35] [V] [TRT] Tactic Name: sm80_xmma_fprop_implicit_gemm_indexed_wo_smem_f16f16_f16f16_f16_nhwckrsc_nhwc_tilesize128x16x64_stage1_warpsize4x1x1_g1_tensor16x8x16_aligna2_alignc2 Tactic: 0xdc0e0882e8ef55d1 Time: 0.441051
[02/25/2024-05:14:35] [V] [TRT] Tactic Name: sm80_xmma_fprop_implicit_gemm_indexed_wo_smem_f16f16_f16f16_f16_nhwckrsc_nhwc_tilesize128x32x16_stage1_warpsize4x1x1_g1_tensor16x8x16_aligna4_alignc4 Tactic: 0x72c5a15b17fc333a Time: 0.196462
[02/25/2024-05:14:35] [V] [TRT] Tactic Name: sm80_xmma_fprop_implicit_gemm_indexed_wo_smem_f16f16_f16f16_f16_nhwckrsc_nhwc_tilesize128x16x32_stage1_warpsize4x1x1_g1_tensor16x8x16_aligna4_alignc4 Tactic: 0x1fb62367b99fe633 Time: 0.195877
[02/25/2024-05:14:35] [V] [TRT] MatMul_161 + BatchNormalization_163 + Relu_165 (CaskConvolution[0x80000009]) profiling completed in 0.0598339 seconds. Fastest Tactic: 0x1fb62367b99fe633 Time: 0.195877
[02/25/2024-05:14:35] [V] [TRT] --------------- Timing Runner: MatMul_161 + BatchNormalization_163 + Relu_165 (CaskFlattenConvolution[0x80000036])
[02/25/2024-05:14:35] [V] [TRT] CaskFlattenConvolution has no valid tactics for this config, skipping
[02/25/2024-05:14:35] [V] [TRT] --------------- Timing Runner: MatMul_161 + BatchNormalization_163 + Relu_165 (CublasConvolution[0x80000029])
[02/25/2024-05:14:35] [V] [TRT] CublasConvolution has no valid tactics for this config, skipping
[02/25/2024-05:14:35] [V] [TRT] >>>>>>>>>>>>>>> Chose Runner Type: CaskConvolution Tactic: 0x1fb62367b99fe633
[02/25/2024-05:14:35] [V] [TRT] *************** Autotuning format combination: Half(3,1:4,3,3) -> Half(16,1:4,16,16) ***************
[02/25/2024-05:14:35] [V] [TRT] --------------- Timing Runner: MatMul_161 + BatchNormalization_163 + Relu_165 (CaskConvolution[0x80000009])
[02/25/2024-05:14:35] [V] [TRT] CaskConvolution has no valid tactics for this config, skipping
[02/25/2024-05:14:35] [V] [TRT] --------------- Timing Runner: MatMul_161 + BatchNormalization_163 + Relu_165 (CaskFlattenConvolution[0x80000036])
[02/25/2024-05:14:35] [V] [TRT] CaskFlattenConvolution has no valid tactics for this config, skipping
[02/25/2024-05:14:35] [V] [TRT] --------------- Timing Runner: MatMul_161 + BatchNormalization_163 + Relu_165 (CublasConvolution[0x80000029])
[02/25/2024-05:14:35] [V] [TRT] CublasConvolution has no valid tactics for this config, skipping
[02/25/2024-05:14:35] [V] [TRT] *************** Autotuning format combination: Half(2,1:8,2,2) -> Float(64,1,1,1) ***************
[02/25/2024-05:14:35] [V] [TRT] --------------- Timing Runner: MatMul_161 + BatchNormalization_163 + Relu_165 (CaskConvolution[0x80000009])
[02/25/2024-05:14:35] [V] [TRT] CaskConvolution has no valid tactics for this config, skipping
[02/25/2024-05:14:35] [V] [TRT] --------------- Timing Runner: MatMul_161 + BatchNormalization_163 + Relu_165 (CaskFlattenConvolution[0x80000036])
[02/25/2024-05:14:35] [V] [TRT] CaskFlattenConvolution has no valid tactics for this config, skipping
[02/25/2024-05:14:35] [V] [TRT] --------------- Timing Runner: MatMul_161 + BatchNormalization_163 + Relu_165 (CublasConvolution[0x80000029])
[02/25/2024-05:14:35] [V] [TRT] CublasConvolution has no valid tactics for this config, skipping
[02/25/2024-05:14:35] [V] [TRT] *************** Autotuning format combination: Half(2,1:8,2,2) -> Half(8,1:8,8,8) ***************
[02/25/2024-05:14:35] [V] [TRT] --------------- Timing Runner: MatMul_161 + BatchNormalization_163 + Relu_165 (CaskConvolution[0x80000009])
[02/25/2024-05:14:35] [V] [TRT] Tactic Name: sm80_xmma_fprop_implicit_gemm_indexed_f16f16_f16f16_f16_nhwckrsc_nhwc_tilesize256x32x32_stage4_warpsize4x1x1_g1_tensor16x8x16 Tactic: 0xdce100b9fe609424 Time: 0.29301
[02/25/2024-05:14:35] [V] [TRT] Tactic Name: sm80_xmma_fprop_implicit_gemm_indexed_wo_smem_f16f16_f16f16_f16_nhwckrsc_nhwc_tilesize128x16x64_stage1_warpsize4x1x1_g1_tensor16x8x16_aligna8_alignc4 Tactic: 0x9d562342491490bf Time: 0.21109
[02/25/2024-05:14:35] [V] [TRT] Tactic Name: sm80_xmma_fprop_implicit_gemm_indexed_wo_smem_f16f16_f16f16_f16_nhwckrsc_nhwc_tilesize128x32x64_stage1_warpsize4x1x1_g1_tensor16x8x16_alignc2 Tactic: 0x18d13b6b3c8edcbe Time: 0.371273
[02/25/2024-05:14:35] [V] [TRT] Tactic Name: sm80_xmma_fprop_implicit_gemm_f16f16_f16f16_f16_nhwckrsc_nhwc_tilesize128x32x32_stage4_warpsize4x1x1_g1_tensor16x8x16_t1r1s1 Tactic: 0xb4ed47991b2d81ae Time: 0.313929
[02/25/2024-05:14:35] [V] [TRT] Tactic Name: sm80_xmma_fprop_implicit_gemm_f16f16_f16f16_f16_nhwckrsc_nhwc_tilesize128x64x32_stage5_warpsize2x2x1_g1_tensor16x8x16_t1r1s1 Tactic: 0x3e2d344492eaa731 Time: 0.282624
[02/25/2024-05:14:35] [V] [TRT] Tactic Name: sm80_xmma_fprop_implicit_gemm_indexed_wo_smem_f16f16_f16f16_f16_nhwckrsc_nhwc_tilesize128x16x32_stage1_warpsize4x1x1_g1_tensor16x8x16_alignc8 Tactic: 0xfbf5ea2d8a6293cd Time: 0.215918
[02/25/2024-05:14:35] [V] [TRT] Tactic Name: sm80_xmma_fprop_implicit_gemm_indexed_wo_smem_f16f16_f16f16_f16_nhwckrsc_nhwc_tilesize128x32x64_stage1_warpsize4x1x1_g1_tensor16x8x16_aligna8_alignc8 Tactic: 0x280b0ad3c23d8442 Time: 0.210798
[02/25/2024-05:14:35] [V] [TRT] Tactic Name: sm80_xmma_fprop_implicit_gemm_indexed_wo_smem_f16f16_f16f16_f16_nhwckrsc_nhwc_tilesize128x32x64_stage1_warpsize4x1x1_g1_tensor16x8x16_aligna2_alignc4 Tactic: 0x6a76904d34985d11 Time: 0.293303
[02/25/2024-05:14:35] [V] [TRT] Tactic Name: sm80_xmma_fprop_implicit_gemm_indexed_wo_smem_f16f16_f16f16_f16_nhwckrsc_nhwc_tilesize128x16x64_stage1_warpsize4x1x1_g1_tensor16x8x16_aligna4_alignc8 Tactic: 0x1498693488a7556d Time: 0.233033
[02/25/2024-05:14:35] [V] [TRT] Tactic Name: sm80_xmma_fprop_implicit_gemm_f16f16_f16f16_f16_nhwckrsc_nhwc_tilesize256x128x32_stage3_warpsize4x2x1_g1_tensor16x8x16 Tactic: 0x60da8c7151d91e47 Time: 0.261998
[02/25/2024-05:14:35] [V] [TRT] Tactic Name: sm80_xmma_fprop_implicit_gemm_indexed_wo_smem_f16f16_f16f16_f16_nhwckrsc_nhwc_tilesize128x16x32_stage1_warpsize4x1x1_g1_tensor16x8x16_alignc2 Tactic: 0xf8d05b73dd3c8ff0 Time: 0.372443
[02/25/2024-05:14:35] [V] [TRT] Tactic Name: sm80_xmma_fprop_implicit_gemm_f16f16_f16f16_f16_nhwckrsc_nhwc_tilesize128x128x64_stage3_warpsize2x2x1_g1_tensor16x8x16_t1r1s1 Tactic: 0x4a33d90483c0ec01 Time: 0.370103
[02/25/2024-05:14:35] [V] [TRT] Tactic Name: sm80_xmma_fprop_implicit_gemm_indexed_wo_smem_f16f16_f16f16_f16_nhwckrsc_nhwc_tilesize128x32x16_stage1_warpsize4x1x1_g1_tensor16x8x16_aligna2_alignc4 Tactic: 0xb97671b320ea2fbb Time: 0.211529
[02/25/2024-05:14:35] [V] [TRT] Tactic Name: sm80_xmma_fprop_implicit_gemm_indexed_wo_smem_f16f16_f16f16_f16_nhwckrsc_nhwc_tilesize128x16x64_stage1_warpsize4x1x1_g1_tensor16x8x16_aligna2_alignc8 Tactic: 0xdf2bb9dcbfb149ec Time: 0.35957
[02/25/2024-05:14:35] [V] [TRT] Tactic Name: sm80_xmma_fprop_implicit_gemm_indexed_wo_smem_f16f16_f16f16_f16_nhwckrsc_nhwc_tilesize128x32x16_stage1_warpsize4x1x1_g1_tensor16x8x16_aligna8_alignc8 Tactic: 0xfb0beb2dd64ff6e8 Time: 0.212114
[02/25/2024-05:14:35] [V] [TRT] Tactic Name: sm80_xmma_fprop_implicit_gemm_f16f16_f16f16_f16_nhwckrsc_nhwc_tilesize128x32x32_stage4_warpsize4x1x1_g1_tensor16x8x16_simple_t1r1s1 Tactic: 0x8047bcfcebface4a Time: 0.232594
[02/25/2024-05:14:35] [V] [TRT] Tactic Name: sm80_xmma_fprop_implicit_gemm_indexed_wo_smem_f16f16_f16f16_f16_nhwckrsc_nhwc_tilesize128x32x64_stage1_warpsize4x1x1_g1_tensor16x8x16_aligna2_alignc2 Tactic: 0xe522659e6357a379 Time: 0.386779
[02/25/2024-05:14:35] [V] [TRT] Tactic Name: sm80_xmma_fprop_implicit_gemm_indexed_wo_smem_f16f16_f16f16_f16_nhwckrsc_nhwc_tilesize128x32x64_stage1_warpsize4x1x1_g1_tensor16x8x16_aligna8_alignc2 Tactic: 0x2b2ebb8d9563987f Time: 0.39029
[02/25/2024-05:14:35] [V] [TRT] Tactic Name: sm80_xmma_fprop_implicit_gemm_indexed_wo_smem_f16f16_f16f16_f16_nhwckrsc_nhwc_tilesize128x32x64_stage1_warpsize4x1x1_g1_tensor16x8x16_alignc4 Tactic: 0x9785ceb86b4122d6 Time: 0.210213
[02/25/2024-05:14:35] [V] [TRT] Tactic Name: sm80_xmma_fprop_implicit_gemm_indexed_wo_smem_f16f16_f16f16_f16_nhwckrsc_nhwc_tilesize128x16x64_stage1_warpsize4x1x1_g1_tensor16x8x16_aligna4_alignc2 Tactic: 0x17bdd86adff94950 Time: 0.325047
